{
  "schema_version": "0.1.0",
  "brief_id": "CENTER-BRIEF-RUN-OFS003-PILOT-005",
  "run_id": "RUN-OFS003-PILOT-005",
  "generated_at": "2026-08-23T19:41:02.520963Z",
  "publication_status": "internal-review-only",
  "run_status": "created",
  "web_coverage_status": "met-declared-scope",
  "profile_coverage_status": "incomplete",
  "consensus_readiness": "incomplete",
  "summary": {
    "center_count": 15,
    "source_count": 30,
    "accepted_current_count": 0,
    "field_status_counts": {
      "users": {
        "verified": 1,
        "partial": 11,
        "unknown": 3,
        "not-applicable": 0
      },
      "priority_domains": {
        "verified": 3,
        "partial": 3,
        "unknown": 9,
        "not-applicable": 0
      },
      "current_system": {
        "verified": 13,
        "partial": 2,
        "unknown": 0,
        "not-applicable": 0
      },
      "refresh_window": {
        "verified": 9,
        "partial": 3,
        "unknown": 3,
        "not-applicable": 0
      },
      "power": {
        "verified": 0,
        "partial": 4,
        "unknown": 11,
        "not-applicable": 0
      },
      "facility": {
        "verified": 4,
        "partial": 6,
        "unknown": 5,
        "not-applicable": 0
      },
      "software": {
        "verified": 3,
        "partial": 4,
        "unknown": 8,
        "not-applicable": 0
      },
      "operations": {
        "verified": 5,
        "partial": 10,
        "unknown": 0,
        "not-applicable": 0
      },
      "migration": {
        "verified": 2,
        "partial": 8,
        "unknown": 5,
        "not-applicable": 0
      },
      "data_connectivity": {
        "verified": 5,
        "partial": 8,
        "unknown": 2,
        "not-applicable": 0
      }
    }
  },
  "transition_signals": [
    {
      "center_id": "CENTER-AIST-IHF",
      "field": "refresh_window",
      "status": "verified",
      "summary": "ABCI 3.0 used a phased October 2024 to January 2025 transition schedule.",
      "evidence_refs": [
        "EVD-1D14F2A226E7"
      ]
    },
    {
      "center_id": "CENTER-AIST-IHF",
      "field": "current_system",
      "status": "partial",
      "summary": "ABCI 3.0 is listed for HPCI, but its FY2026 resource amount was not determined.",
      "evidence_refs": [
        "EVD-2CDF7DDE0742"
      ]
    },
    {
      "center_id": "CENTER-HOKKAIDO-IIC",
      "field": "refresh_window",
      "status": "partial",
      "summary": "A 32-GPU-node expansion was planned for HPCI availability from April 2027, with an explicit caveat that the plan may change.",
      "evidence_refs": [
        "EVD-AD52CD68CE69"
      ]
    },
    {
      "center_id": "CENTER-ISM-CSST",
      "field": "refresh_window",
      "status": "partial",
      "summary": "The current HPE Cray XD2000 configuration is documented, but its start date and successor window are not established by the assigned Evidence.",
      "evidence_refs": [
        "EVD-23226C422FCD"
      ]
    },
    {
      "center_id": "CENTER-JCAHPC",
      "field": "refresh_window",
      "status": "verified",
      "summary": "Miyabi began operation in January 2025.",
      "evidence_refs": [
        "EVD-1F11556E3E57"
      ]
    },
    {
      "center_id": "CENTER-KYOTO-ACCMS",
      "field": "refresh_window",
      "status": "verified",
      "summary": "The final component of the current service entered operation in October 2023.",
      "evidence_refs": [
        "EVD-8FF4CADC505C"
      ]
    },
    {
      "center_id": "CENTER-NAGOYA-ITC",
      "field": "refresh_window",
      "status": "verified",
      "summary": "The next system was scheduled for an October 1, 2026 launch.",
      "evidence_refs": [
        "EVD-01B9B46A8639"
      ]
    },
    {
      "center_id": "CENTER-NAGOYA-ITC",
      "field": "current_system",
      "status": "partial",
      "summary": "Furo NEXT/Furo II was scheduled to begin service in October 2026 and was not yet operating at the evidence date.",
      "evidence_refs": [
        "EVD-DEC1BBC85941"
      ]
    },
    {
      "center_id": "CENTER-OSAKA-D3",
      "field": "refresh_window",
      "status": "verified",
      "summary": "SQUID and ONION service is scheduled to end on June 30, 2027.",
      "evidence_refs": [
        "EVD-BC32FF7D6542"
      ]
    },
    {
      "center_id": "CENTER-RIKEN-IRDS",
      "field": "refresh_window",
      "status": "verified",
      "summary": "The published operating period runs from December 2023 through November 2029.",
      "evidence_refs": [
        "EVD-9758FC94E6E1"
      ]
    },
    {
      "center_id": "CENTER-RIKEN-RCCS",
      "field": "refresh_window",
      "status": "partial",
      "summary": "FugakuNEXT operation is targeted around 2030; this remains a prospective milestone.",
      "evidence_refs": [
        "EVD-F102B716B884"
      ]
    },
    {
      "center_id": "CENTER-SCIENCE-TOKYO-IIC",
      "field": "refresh_window",
      "status": "verified",
      "summary": "TSUBAME4 service began in April 2024 and the TSUBAME3 storage-only migration window ended in June 2024.",
      "evidence_refs": [
        "EVD-CC4065651CF8"
      ]
    },
    {
      "center_id": "CENTER-TSUKUBA-CCS",
      "field": "refresh_window",
      "status": "verified",
      "summary": "Sirius began operation on March 27, 2026.",
      "evidence_refs": [
        "EVD-E8847845A0ED"
      ]
    },
    {
      "center_id": "CENTER-UTOKYO-ITC",
      "field": "refresh_window",
      "status": "verified",
      "summary": "Miyabi began operation in January 2025.",
      "evidence_refs": [
        "EVD-88C74349E625"
      ]
    }
  ],
  "priority_followups": [
    {
      "field": "power",
      "affected_center_count": 15,
      "center_ids": [
        "CENTER-AIST-IHF",
        "CENTER-HOKKAIDO-IIC",
        "CENTER-ISM-CSST",
        "CENTER-JAMSTEC-CEIST",
        "CENTER-JCAHPC",
        "CENTER-KYOTO-ACCMS",
        "CENTER-KYUSHU-RIIT",
        "CENTER-NAGOYA-ITC",
        "CENTER-OSAKA-D3",
        "CENTER-RIKEN-IRDS",
        "CENTER-RIKEN-RCCS",
        "CENTER-SCIENCE-TOKYO-IIC",
        "CENTER-TOHOKU-CSC",
        "CENTER-TSUKUBA-CCS",
        "CENTER-UTOKYO-ITC"
      ],
      "research_instruction": "Find current official primary evidence for power for each listed center; retain unknown when no public evidence is found."
    },
    {
      "field": "users",
      "affected_center_count": 14,
      "center_ids": [
        "CENTER-AIST-IHF",
        "CENTER-HOKKAIDO-IIC",
        "CENTER-ISM-CSST",
        "CENTER-JAMSTEC-CEIST",
        "CENTER-JCAHPC",
        "CENTER-KYOTO-ACCMS",
        "CENTER-KYUSHU-RIIT",
        "CENTER-NAGOYA-ITC",
        "CENTER-OSAKA-D3",
        "CENTER-RIKEN-IRDS",
        "CENTER-SCIENCE-TOKYO-IIC",
        "CENTER-TOHOKU-CSC",
        "CENTER-TSUKUBA-CCS",
        "CENTER-UTOKYO-ITC"
      ],
      "research_instruction": "Find current official primary evidence for users for each listed center; retain unknown when no public evidence is found."
    },
    {
      "field": "migration",
      "affected_center_count": 13,
      "center_ids": [
        "CENTER-AIST-IHF",
        "CENTER-HOKKAIDO-IIC",
        "CENTER-ISM-CSST",
        "CENTER-JAMSTEC-CEIST",
        "CENTER-JCAHPC",
        "CENTER-KYOTO-ACCMS",
        "CENTER-KYUSHU-RIIT",
        "CENTER-NAGOYA-ITC",
        "CENTER-OSAKA-D3",
        "CENTER-RIKEN-IRDS",
        "CENTER-RIKEN-RCCS",
        "CENTER-TSUKUBA-CCS",
        "CENTER-UTOKYO-ITC"
      ],
      "research_instruction": "Find current official primary evidence for migration for each listed center; retain unknown when no public evidence is found."
    },
    {
      "field": "priority_domains",
      "affected_center_count": 12,
      "center_ids": [
        "CENTER-HOKKAIDO-IIC",
        "CENTER-JAMSTEC-CEIST",
        "CENTER-JCAHPC",
        "CENTER-KYOTO-ACCMS",
        "CENTER-KYUSHU-RIIT",
        "CENTER-OSAKA-D3",
        "CENTER-RIKEN-IRDS",
        "CENTER-RIKEN-RCCS",
        "CENTER-SCIENCE-TOKYO-IIC",
        "CENTER-TOHOKU-CSC",
        "CENTER-TSUKUBA-CCS",
        "CENTER-UTOKYO-ITC"
      ],
      "research_instruction": "Find current official primary evidence for priority_domains for each listed center; retain unknown when no public evidence is found."
    },
    {
      "field": "software",
      "affected_center_count": 12,
      "center_ids": [
        "CENTER-AIST-IHF",
        "CENTER-HOKKAIDO-IIC",
        "CENTER-JAMSTEC-CEIST",
        "CENTER-JCAHPC",
        "CENTER-KYOTO-ACCMS",
        "CENTER-OSAKA-D3",
        "CENTER-RIKEN-IRDS",
        "CENTER-RIKEN-RCCS",
        "CENTER-SCIENCE-TOKYO-IIC",
        "CENTER-TOHOKU-CSC",
        "CENTER-TSUKUBA-CCS",
        "CENTER-UTOKYO-ITC"
      ],
      "research_instruction": "Find current official primary evidence for software for each listed center; retain unknown when no public evidence is found."
    },
    {
      "field": "facility",
      "affected_center_count": 11,
      "center_ids": [
        "CENTER-AIST-IHF",
        "CENTER-HOKKAIDO-IIC",
        "CENTER-JAMSTEC-CEIST",
        "CENTER-JCAHPC",
        "CENTER-KYOTO-ACCMS",
        "CENTER-RIKEN-IRDS",
        "CENTER-RIKEN-RCCS",
        "CENTER-SCIENCE-TOKYO-IIC",
        "CENTER-TOHOKU-CSC",
        "CENTER-TSUKUBA-CCS",
        "CENTER-UTOKYO-ITC"
      ],
      "research_instruction": "Find current official primary evidence for facility for each listed center; retain unknown when no public evidence is found."
    },
    {
      "field": "data_connectivity",
      "affected_center_count": 10,
      "center_ids": [
        "CENTER-AIST-IHF",
        "CENTER-HOKKAIDO-IIC",
        "CENTER-ISM-CSST",
        "CENTER-JCAHPC",
        "CENTER-OSAKA-D3",
        "CENTER-RIKEN-IRDS",
        "CENTER-RIKEN-RCCS",
        "CENTER-SCIENCE-TOKYO-IIC",
        "CENTER-TOHOKU-CSC",
        "CENTER-UTOKYO-ITC"
      ],